{
  "apiVersion": "workspace.socioprophet.dev/v1",
  "kind": "WorkspaceSource",
  "metadata": {
    "sourceId": "workspace-source:sheets/demo-dataset",
    "name": "Demo dataset spreadsheet",
    "createdAt": "2026-04-27T00:00:00Z",
    "labels": {"surface": "sheets", "demo": "lattice-studio"}
  },
  "spec": {
    "surface": "sheets",
    "sourceType": "spreadsheet",
    "ownerScope": "user:demo-user",
    "projectScope": "project:demo-project",
    "backendRef": "gsheets://demo-dataset",
    "versionRef": "v0.1.0",
    "contentDigest": "sha256:2222222222222222222222222222222222222222222222222222222222222222",
    "modifiedAt": "2026-04-27T00:00:00Z",
    "policyRef": "policy://workspace/demo",
    "retentionPolicyRef": "retention://workspace/default",
    "evidenceCorrelationId": "workspace-source:sheets/demo-dataset",
    "sourceUri": "workspace://sheets/demo-dataset",
    "tags": ["dataset", "spreadsheet", "lattice-studio"]
  }
}
